"","num_var","ngo_name","ngo_address","reg_no","reg_date","renewed_on","valid_until","district","county","remarks","type_ngo"
"2042",2042,"Siam Shikha & Shastha Unnayan Sangstha","Bargaria, Chapainababgonj, Phone: 01713-701214","2764 ","13-Feb-13 "," ","13-Feb-18 ","Chapainababganj ","Bangladesh "," ","local"
"2043",2043,"Sight Savers-Royal Commonwealth Society for the Blind ","House-1/B (5th floor), Road-08, Block-I, Banani, Dhaka-1213 Phone: 8826821, Fax: 8826580 www.sightsavers.org","7   ","22-Apr-81   ","15-May-15   ","15-May-20   ","Dhaka   ","UK   ","   ","local"
"2044",2044,"Sil International  ","House-11, Road-19/A, Sector- 04, Uttara, Dhaka-1234 Phone: 58950923","1571  ","5-Oct-00  ","5-Oct-15  ","5-Oct-20  ","Dhaka  ","USA  ","  ","local"
"2045",2045,"Singher Khajura Bastuhara Samaj Kalyan Samity","Post+P.S: Monirampur, Jessore Phone: 04227-78212","252 ","4-Jan-88 ","4-Jan-18 ","4-Jan-28 ","Jessore ","Bangladesh "," ","local"
"2046",2046,"Sinnomul Mohila Samity   ","Palashbari Road, Gaibandha- 5700 Phone: 0541-61695 e-mail: smsgai79@gmail-com","144   ","6-Jul-83   ","15-May-15   ","15-May-20   ","Gaibandha   ","Bangladesh   ","   ","local"
"2047",2047,"Sir William Beveridge Foundation   ","Hasan Holdings (6th Floor), 52/1, New Eskaton Road, Ramna, Dhaka-1000 Phone: 9353633, Fax: 9361500 www.beveridgefoundation.org","2262    ","15-Aug-07    ","15-Aug-17    ","15-Aug-27    ","Dhaka    ","UK    ","    ","local"
"2048",2048,"Sirajgonj Uttaran Mohila Sangstha  ","Wapda Bazar, Mirpur, Sirajganj- 6700 Phone: 01711-350626 ","848   ","6-Aug-94   ","6-Aug-14   ","6-Aug-19   ","Sirajganj   ","Bangladesh   ","Cancelled on 18/08/2004, Revived on 26/08/2010","local"
"2049",2049,"Sisu Sorgho   ","Anjuman Bhaban, Bar Quarter, Pahartoli, Chittagong. 01556-498703 wwwchildhavan.ca","2215   ","4-Mar-07   ","4-Apr-17   ","4-Apr-27   ","Chittagong   ","Bangladesh   ","   ","local"
"2050",2050,"SKILLS  ","136/3, (3rd Floor), Peer Saheber Goli, Shantinagar, Dhaka.","1915  ","11-Sep-04  ","  ","11-Sep-09  ","Dhaka  ","Bangladesh  ","  ","local"
"2051",2051,"SKS Foundation    ","College Road, Uttar Horinsngha, Gaibandha-5700 Phone: 0541-51492, Fax: 0541- 51492 www.sks-bd.org","1215    ","18-Nov-97    ","18-Nov-17    ","18-Nov-27    ","Gaibandha    ","Bangladesh    ","    ","local"
"2052",2052,"Small Kindness Bangladesh  ","296/F, Tali Office Road, Rayer Bazar, Dhaka.  ","1498   ","27-Mar-00   ","27-Mar-15   ","27-Mar-20   ","Dhaka   ","Bangladesh   ","Cancelled on 26/05/2010, Revived on 12/5/2016","local"
"2053",2053,"SMC (Sacheon Multi Cultural Intigration Support Center","House-24 (Gr. Fl.), Road-4, Sector-12, Uttara, Dhaka. Phone: 01779-479566","2826  ","30-Oct-13  ","30-Oct-18  ","30-Oct-28  ","Dhaka  ","South Korea  ","  ","local"
"2054",2054,"Smile Social Welfare Association","Town Masjid Road, Habiganj, Pourashava-3300, Habiganj","3074 ","3-Jan-17 "," ","3-Jan-22 ","Habiganj ","Bangladesh "," ","local"
"2055",2055,"Smyrna Development Society  ","69, Senpara Parbata (1st Floor), Mirpur-10, Dhaka-1216 Phone: 8051166 www.smyrnabd.org","2523   ","22-Dec-09   ","22-Dec-14   ","22-Dec-19   ","Dhaka   ","Bangladesh   ","   ","local"
"2056",2056,"SNV Netherlands Development Organization, Bangladesh ","House-11, Road-72, Gulshan-2, Dhaka Phone: 9888708-9 www.snv.org","2086   ","10-Apr-06   ","10-Apr-16   ","10-Apr-21   ","Dhaka   ","Bangladesh   ","   ","local"
"2057",2057,"Social & Cultural Development Foundation","Nimnagar, Balibari, Dinajpur Phone: 0531-51038","2944 ","29-Jul-15 "," ","29-Jul-20 ","Dinajpur ","Bangladesh "," ","local"
"2058",2058,"Social & Economic Enhencedment Programme (SEEP)  ","House-5, Road-4, Block-A, Section-11, Mirpur, Dhaka, Phone : 01711-066878, 9012782, 8032243 www.seep.org.bd","993    ","7-Dec-95    ","7-Dec-15    ","7-Dec-20    ","Dhaka    ","Bangladesh    ","    ","local"
"2059",2059,"Social Action for Voluntary Efforts ","Roney Villa, North Mozupur, Laximpur-3700 Phone: 01711-112075","2752  ","12-Dec-12  ","12-Dec-17  ","12-Dec-27  ","Laxmipur  ","Bangladesh  ","  ","local"
"2060",2060,"Social Advancement and Reconstruction Association (SARA)","Vill: Parala, PO: Amrjhuta, Monirampur, Jessore Phone: 01716422625","3061  ","14-Dec-16  ","  ","14-Dec-21  ","Jessore  ","Bangladesh  ","  ","local"
"2061",2061,"Social Advancement and Rehabilitation Centre (SARC) ","Vill.- Chalkidanga, Manirampur, Jessore. Phone: 01716-142593, Fax: 0421-72404","1873   ","16-Sep-03   ","16-Sep-18   ","16-Sep-28   ","Jessore   ","Bangladesh   ","   ","local"
"2062",2062,"Social Advancement and Village Economic (SAVE)   ","Rasulpur Bazar, P.O: Abdullahpur, Thana: Keraniganj, Dhaka-1311 Phone: 01678323223, 1713514207","1488    ","28-Feb-00    ","28-Feb-15    ","28-Feb-20    ","Dhaka    ","Bangladesh    ","    ","local"
"2063",2063,"Social Advancement Centre (SAC)  ","Sufiya Bhaban, 138, Shaheed Rafiq Sarak, P.O.: Manikganj, Dist: Manikganj. Phone: 01711-909","900   ","14-Feb-95   ","14-Feb-00   ","14-Feb-05   ","Manikganj   ","Bangladesh   ","   ","local"
"2064",2064,"Social Advancement Community Organization","Police Line Road, Barguna Phone: 01714-016190","2724 ","7-Aug-12 ","7-Aug-17 ","7-Aug-27 ","Barguna ","Bangladesh "," ","local"
"2065",2065,"Social Advancement Development Organisation (SADO)  ","94/4, Kalibari Road, (Nikunjo R/A), Patgadam, Mymensingh. Phone: 091-54883, Fax: 091-  54834","1203    ","3-Oct-97    ","23-Oct-08    ","23-Oct-13    ","Mymensingh    ","Bangladesh    ","Cancelled on 09/08/2010, Revived on 29/04/2012 ","local"
"2066",2066,"Social Advancement for Peoples Liberation Agency (SAPLA) ","Vill: Kechuakora, PO: Ahmedpur Bazar, UZ: Baraigram, Dist: Natore-6433 Phone: 01711-363153","297   ","18-May-89   ","18-May-14   ","18-May-19   ","Natore   ","Bangladesh   ","   ","local"
"2067",2067,"Social Advancement For Rural Mass (SARM)  ","2/1, Hazi Dilgoni Market, Mohammadpur, Dhaka., Phone: 01835-150575 ","1272   ","14-Jun-98   ","14-Jun-18   ","14-Jun-28   ","Dhaka   ","Bangladesh   ","Cancelled on 29/07/2010, Revived on 24/01/2011","local"
"2068",2068,"Social Advancement for Rural Poor","House-Sagorika 1/1, Block-B, Lalmatia, Dhaka.","2695 ","17-May-12 "," ","17-May-17 ","Dhaka ","Bangladesh "," ","local"
"2069",2069,"Social Advancement Program & Networking Organization ","Sohid Khaknon Road, Jales waritola, Bogra-5800 Phone: 051-66058 www.sapno.bd.org.","2543   ","15-Feb-10   ","15-Feb-15   ","15-Feb-20   ","Bogra   ","Bangladesh   ","   ","local"
"2070",2070,"Social Advancement Society (SAS)  ","Sajher Maya, 104, Baptist Mission Road, Barisal. Phone: 0431-63286, Fax: 0431- 60373","2162   ","21-Nov-06   ","22-Nov-11   ","22-Nov-16   ","Barisal   ","Bangladesh   ","   ","local"
"2071",2071,"Social Advancement Through Unity    ","Plot-91, Block-2, Road-12, Tangail Housing Estate, Paschim Akur Takur Para, Tangail. Phone: 0921-63674, Fax: 92151723","795     ","29-Dec-93     ","29-Dec-18     ","29-Dec-28     ","Tangail     ","Bangladesh     ","     ","local"
"2072",2072,"Social Aid     ","Khalid Monjil, Link Road, Cox'sBazar Sadar, Cox'sBazar Cell: 0088-01859-222227 email: socialaid.org.bd@gmail.com web: www.socialaid.org.bd","2541     ","8-Feb-10     ","8-Feb-15     ","8-Feb-25     ","Cox'sBazar     ","Bangladesh     ","Nane Change on 6/6/2018    ","local"
"2073",2073,"Social Aid in Bangladesh   ","Vill: Mohiuddin Howladar Kandi, P.O: Dori Kandi, Upazila: Jajira, Dist.: Shariatpur. Phone: 01712-968911","2494   ","13-Oct-09   ","13-Oct-14   ","13-Oct-19   ","Shariatpur   ","Bangladesh   ","   ","local"
"2074",2074,"Social and Agriculture Development Organization (ISADO)","House-41, M.R. Road, Magura Phone: 01716-317919 ","2819  ","29-Sep-13  ","  ","29-Sep-18  ","Magura  ","Bangladesh  ","  ","local"
"2075",2075,"Social and Economic Benevolent Association (SEBA)","Vill: Vootmara, PO: Dupthi, Upazilla: Sdar, Barguna Phone: 01710436851","3065  ","14-Dec-16  ","  ","14-Dec-21  ","Barguna  ","Bangladesh  ","  ","local"
"2076",2076,"Social Assistance & Rehabilitation For the Physically Vulnerable(SARPV)  ","House-589, Road-11, Baitul Aman Housing Society, Adabar, Dhaka. Phone: 8190253-4, Fax: 8190256 www.sparpv.org","409     ","15-Nov-90     ","15-Nov-15     ","15-Nov-20     ","Dhaka     ","Bangladesh     ","     ","local"
"2077",2077,"Social Assistance for Community Development (SADC) ","House-153, Road-8, South Bishil, Mirpur-1, Dhaka-1216 Phone: 01552-349169 www.sacdbd.org","2137   ","27-Sep-06   ","27-Sep-11   ","27-Sep-16   ","Dhaka   ","Bangladesh   ","   ","local"
"2078",2078,"Social Association for Fundamental Empowerment (SAFE) ","Kholil Complex, Digarkanda, Sadar, Mymensing  ","830   ","18-May-94   ","18-May-14   ","18-May-24   ","Mymensingh   ","Bangladesh   ","Cancelled on 15/06/2010, Revived on: 14/12/2017","local"
"2079",2079,"Social Association for Rural Advancement(SARA) ","23/1, Sardah Gosh Road, Nandibari, Mymensingh, Phone : 091-67877","201  ","23-Jan-86  ","23-Jan-16  ","23-Jan-26  ","Mymensingh  ","Bangladesh  ","  ","local"
"2080",2080,"Social Development Association Comilla ","Vill: Bitman, PO: Illiateganj: PS: Daudkandi, Dist: Comilla. Phone: 01819-141644","2806  ","4-Aug-13  ","  ","4-Aug-18  ","Comilla  ","Bangladesh  ","  ","local"
"2081",2081,"Social Development Organization of Bangladesh (SDOB) ","Adarsha Housing Society (4th Floor), Panchgasia Road, Mohipal, Feni. Phone: 0331-611831","2511   ","5-Nov-09   ","5-Nov-14   ","5-Nov-19   ","Feni   ","Bangladesh   ","   ","local"
"2082",2082,"Social Development Program (SODEP)  ","Sadar Road, Shariatpur-8000 Phone: 0601-51009, Fax: 0601- 61179 www.sodepbd.org","2080   ","6-Mar-06   ","6-Mar-11   ","6-Mar-16   ","Shariatpur   ","Bangladesh   ","   ","local"
"2083",2083,"Social Development Services (SDS)","West Balighata, PO+PS: Panchbibi, Dist: Joypurhat.","2620 ","26-Jan-11 ","30-Jan-16 ","30-Jan-21 ","Joypurhat ","Bangladesh "," ","local"
"2084",2084,"Social Development Society (SDS) ","Munni Nibash, North Alekanda, Barisal City, Barisal. Phone: 0431-2173852","335  ","9-Jan-90  ","9-Jan-10  ","9-Jan-15  ","Barisal  ","Bangladesh  ","  ","local"
"2085",2085,"Social Edification of Benign Acimilation Society(SEBA)","House-146/3, Khanjahan Ali Road, Khulna-9100 Phone: 041-720158","1646  ","10-Jun-01  ","10-Jun-16  ","10-Jun-26  ","Khulna  ","Bangladesh  ","  ","local"
"2086",2086,"Social Environment and Rural Development Organisation (SERDO) ","Sher-e-Bangla Road, Matullabad, Barisal-8205 Phone:01711-939874 ","1800   ","24-Feb-03   ","20-Feb-08   ","20-Feb-13   ","Barisal   ","Bangladesh   ","Cancelled on 15/06/2010, Revived on 4/5/2011","local"
"2087",2087,"Social Equality for Effective Development (SEED)","House-503/1, New Ward No.- 04, Kakrul Road, Rangpur-5400 Phone: 0521-52360","2274  ","27-Sep-07  ","27-Sep-17  ","27-Sep-27  ","Rangpur  ","Bangladesh  ","  ","local"
"2088",2088,"Social Health and Education Development Board (SHED-Board) ","33, Senpara Parbata, Mirpur, Section # 10, Dhaka Phone :9020682, Fax: 9005842 www.shedboard.org","134   ","23-Nov-82   ","15-May-15   ","15-May-20   ","Dhaka   ","Bangladesh   ","   ","local"
"2089",2089,"Social Initiative for Human Development   ","Isapuri Lodge, Mymensing Road, (Old Bus stand), Tangail- 1900 Phone: 0921-54731, Fax: 0921- 545118","2356    ","14-May-08    ","    ","14-May-13    ","Tangail    ","Bangladesh    ","    ","local"
"2090",2090,"Social Institute   ","Plot 1/A, Block-D, Arifabad Housing Society, Pallabi Extension, Dhaka. Phone : 0171-527421","371   ","3-Mar-90   ","3-Mar-95   ","3-Mar-00   ","Dhaka   ","Bangladesh   ","   ","local"
"2091",2091,"Social Motivatin Service (SMS)","Sujalpur, Birganj, Dinajpur Phone: 01741702390","3013 ","29-Feb-16 "," ","28-Feb-21 ","Dinajpur ","Bangladesh "," ","local"
"2092",2092,"Social Organization for Develoment of Abandoned Children (SODAC)","Aricha Ghat, Shibaloy, Manikgong ","1662  ","20-Feb-06  ","  ","20-Feb-11  ","Manikganj  ","Bangladesh  ","  ","local"
"2093",2093,"Social Organization for Life & Creation (SOLC)","Vill.+Post: Chowgacha, Dist.: Jessore-7400","2192 ","24-Jan-07 "," ","24-Jan-12 ","Jessore ","Bangladesh "," ","local"
"2094",2094,"Social Organization for Rural Development (SORD)","Joyra College Road, Manikgonj.  ","2227  ","25-Apr-07  ","  ","25-Apr-12  ","Manikganj  ","Bangladesh  ","  ","local"
"2095",2095,"Social Outreach Program For Development ","12/25 Sir Syed Road, Block-A, Mohammadpur, Dhaka. Phone : 8123155","968  ","11-Sep-95  ","11-Sep-10  ","11-Sep-15  ","Dhaka  ","Bangladesh  ","  ","local"
"2096",2096,"Social Progress Services (SPS)  ","101 Bottola, Sherpur Sadar, Sherpur. Phone: 01711-176775 ","513   ","7-Aug-91   ","7-Aug-16   ","7-Aug-26   ","Sherpur   ","Bangladesh   ","Cancelled on 27/06/2010, Revived on 30/05/2013","local"
"2097",2097,"Social Prosperity by Native Organization (SOPNO)","64/23 Aurjun Das, Agorwala Road, Courtpara, Kustia.","2295 ","18-Dec-07 "," ","18-Dec-12 ","Kustia ","Bangladesh "," ","local"
"2098",2098,"Social Reconstruction Action ","297, Kazipara, Kathaltola Road, Jessore. Phone: 0421-66853","2575  ","20-May-10  ","  ","20-May-15  ","Jessore  ","Bangladesh  ","  ","local"
"2099",2099,"Social Service Society  ","Vill: Kamarjuri, PO: National University, Gazipur. Phone: 01839-958760","2888  ","25-Aug-14  ","  ","25-Aug-19  ","Gazipur  ","Bangladesh  ","  ","local"
"2100",2100,"Social Support Organization (SSO) ","724, West Shewrapara, Mirpur, Dhaka-1216. Mob: 01711050651","3215  ","7-Aug-19  ","  ","7-Aug-29  ","Dhaka  ","Bangladesh  ","  ","local"
"2101",2101,"Social Un-obstructive Help Association (SUHA)  ","25/1, Issha Kha Road, Nagorkhanpur, Narayanganj- 1400 Phone: 7643517","2578   ","23-May-10   ","   ","23-May-15   ","Narayanganj   ","Bangladesh   ","   ","local"
"2102",2102,"Social Upliftment Society (SUS)   ","76/A, Uttarpara, P.S: Savar, Dhaka-1340 Phone: 7746299, 01715022673 www.bangladeshngo.com/ngo/s us","1094    ","2-Nov-96    ","2-Nov-16    ","2-Nov-21    ","Dhaka    ","Bangladesh    ","    ","local"
"2103",2103,"Social Welfare Advancement Committee (SWACO)  ","Staff Quarter More, Circuit House Road, Chaklapara, Jhenidah-7300  Phone: 0451-61747","1954    ","5-Sep-04    ","5-Sep-14    ","5-Sep-19    ","Jhenaidah    ","Bangladesh    ","Cancelled on 27/06/2010, Revived on 1/2/2011 ","local"
"2104",2104,"Social Welfare Association for Total Community","93, Senpara Parbata, Mirpur-10, Dhaka.","2070 ","14-Feb-06 "," ","14-Feb-11 ","Dhaka ","Bangladesh "," ","local"
"2105",2105,"Social Welfare Improvement Trust (SWIT)","40, Mujgunni Dakhinpara Road, Khulna","1425 ","16-Sep-99 ","16-Sep-09 ","16-Sep-14 ","Khulna ","Bangladesh "," ","local"
"2106",2106,"Social Women Organisation for Village Advancement (SWOVA)","Dhupchachia (Near forest Office), Bogra-5880 Phone : 03754-001336","1624  ","11-Mar-01  ","11-Mar-16  ","11-Mar-21  ","Bogra  ","Bangladesh  ","  ","local"
"2107",2107,"Social Work for Awarness Development Environment & Social Health (SWADESH)","9/25 (3rd Floor), Block-C, Humayun Road, Mohammadpur, Dhaka-1207 Phone: 01711-561656","1734   ","3-Aug-04   ","3-Aug-14   ","3-Aug-19   ","Dhaka   ","Bangladesh   ","   ","local"
"2108",2108,"Society Development Agency","PTI Road, Patuakhali Phone: 01712-103394","2896 ","14-Oct-14 "," ","14-Oct-19 ","Patuakhali ","Bangladesh "," ","local"
"2109",2109,"Society Development Committee  ","Zaman Monjil, Road-01, Goalchamot, Faridpur. Phone: 0631-65854 www.sdcbd.org","533   ","26-Sep-91   ","16-Sep-16   ","16-Sep-21   ","Faridpur   ","Bangladesh   ","   ","local"
"2110",2110,"Society Development Organization  ","Mukto Bangla Shoping Complex, Level-4, Office No.- 212, Mirpur-1, Dhaka-1216 Mob: 01735985023","3166   ","23-Oct-18   ","   ","23-Oct-28   ","Dhaka   ","Bangladesh   ","   ","local"
"2111",2111,"Society Exhort Relation and Vocational Education (SERVE)  ","Mecca Tower, House-98, Road- 12, Sector-10, Uttara Model Towen, Dhaka Phone: 8961826 www.servebangladesh.org","2195    ","18-Feb-07    ","18-Feb-12    ","18-Feb-17    ","Dhaka    ","Bangladesh    ","    ","local"
"2112",2112,"Society for Action Research & Development (SARD)","40/D, Dilu Road, (1st Fl.) New Eskaton, Dhaka-1000 Phone : 9345068","459  ","10-Apr-91  ","10-Apr-11  ","10-Apr-16  ","Dhaka  ","Bangladesh  ","  ","local"
"2113",2113,"Society for Advancement in Education and Training","32/2, Azimpur, Lalbag, Dhaka. Phone: 01711-452231","2710 ","18-Jun-12 "," ","18-Jun-17 ","Dhaka ","Bangladesh "," ","local"
"2114",2114,"Society for Advancement of Rural Area  ","House-03, Road-8A, Nikunjo-1, Khilkhet, Dhaka-1209 Phone: 8900500, Fax: 9851124 ","750   ","18-Sep-93   ","18-Sep-18   ","18-Sep-28   ","Dhaka   ","Bangladesh   ","Cancelled on 25/07/2010, Revived on 10/2/2011","local"
"2115",2115,"Society for Alleviation of Rural Poverty (SARP)  ","Sonali Bank Bhaban (1st East Fl.), Goshair Hat, Shariatpur. Phone: 0602475086, 1712086106","2084   ","27-Mar-06   ","27-Mar-16   ","27-Mar-21   ","Shariatpur   ","Bangladesh   ","   ","local"
"2116",2116,"Society for Assistance to Hearing Impaired Children (SAHIC) ","BCPS Campus, Mohakhali, Dhaka - 1212 Phone : 8822007, 9881535 www.sahicbd.org","398   ","22-Oct-90   ","22-Oct-15   ","22-Oct-20   ","Dhaka   ","Bangladesh   ","   ","local"
"2117",2117,"Society for Awareness & Development of Disabled ","House-9, Road-19, Rupnagar R/A, Pallabi, Mirpur, Dhaka-1216 Phone: 01714-072642","2491  ","13-Oct-09  ","13-Oct-14  ","13-Oct-19  ","Dhaka  ","Bangladesh  ","  ","local"
"2118",2118,"Society for Biodiversity Conservation (SBC) ","Hazi Mansion (1st Floor), Bridge Par, PO & UZ: Jhinaigati, Dist: Sherpur-2100","2486  ","4-Oct-09  ","4-Oct-14  ","4-Oct-19  ","Sherpur  ","Bangladesh  ","  ","local"
"2119",2119,"Society for Bright Social Services  ","68/5/1, South Mugdha Para, Dhaka-1214 Phone: 01817-549700 www.brightysocial.org","2584   ","24-Jun-10   ","24-Jun-15   ","24-Jun-20   ","Dhaka   ","Bangladesh   ","   ","local"
"2120",2120,"Society for Development Initiatives (SDI)  ","House-2/4, Block-C, Shahjahan Road, Mohammadpur, Dhaka- 1217 Phone: 9122210, Fax: 9145381","937   ","25-May-95   ","25-May-15   ","25-May-20   ","Dhaka   ","Bangladesh   ","   ","local"
"2121",2121,"Society for Economic & Basic Advancement (SEBA), The ","Road-23, House-B165, DOHS Mohakhali, Dhaka-1212 Phone: 8825909 www.seba-bd.org","232   ","30-Aug-87   ","30-Aug-12   ","30-Aug-17   ","Dhaka   ","Bangladesh   ","   ","local"
"2122",2122,"Society for Economic & Environmental Development (SEED)","152/2-I, Green Road, pathopath, Dhaka Phone: 01713-029292","2902  ","18-Oct-14  ","  ","18-Oct-19  ","Dhaka  ","Bangladesh  ","  ","local"
"2123",2123,"Society for Education & Care of Hearing Impaired Children of Bangladesh","House-3/2, North Road (Bhuter Goli), dhanmondi Dhaka-1209 Phone: 9119535","164  ","18-Apr-84  ","15-May-15  ","15-May-20  ","Dhaka  ","Bangladesh  ","  ","local"
"2124",2124,"Society for Education in Theatre ","House-10/A, Road-25/A, Block- A, Banani, Dhaka. Phone: 8832278, Fax: 8811664","930  ","19-Apr-95  ","19-Apr-05  ","19-Apr-10  ","Dhaka  ","Bangladesh  ","  ","local"
"2125",2125,"Society for Education of the Intelectually Disabled, Bangladesh","9/6, Lalmatia, Block-B (1st Floor), Dhaka-1207. Phone: 9131791","2042  ","25-Oct-05  ","  ","25-Oct-10  ","Dhaka  ","Bangladesh  ","  ","local"
"2126",2126,"Society for Empowerment, Education and Development","118/1 (2nd Floor), Wareless Gate, Mohakhali, Dhaka-1212 www.seed.org.bd","2577  ","20-May-10  ","  ","20-May-15  ","Dhaka  ","Bangladesh  ","  ","local"
"2127",2127,"Society for Environmennt & Human Development (SEHD)","1/1 Pallabi (5th Floor), Mirpur, Dhaka-1216 Phone: 9026636, Fax: 8060828","839  ","23-Jun-94  ","23-Jun-14  ","23-Jun-19  ","Dhaka  ","Bangladesh  ","  ","local"
"2128",2128,"Society for Environment & Development Observer (SDO)","Post + Upazila: Palong Sadar Road, Dist: Shariatpur-8000 Phone: 01818-355824","2066  ","31-Jan-06  ","31-Jan-11  ","31-Jan-16  ","Shariatpur  ","Bangladesh  ","  ","local"
"2129",2129,"Society for Health Extension & Development (SHED) ","ICDDRB Campus, Main Road, Teknaf Pourasava, Teknaf, Coxsbazar Phone: 0342675144","408   ","14-Nov-90   ","14-Nov-15   ","14-Nov-20   ","Cox'sBazar   ","Bangladesh   ","   ","local"
"2130",2130,"Society for Idea in rural and Social Development ","23/9, Khilji Road, Shamoli, Mohammadpur, Dhaka. Phone: 9139303","2291  ","27-Nov-07  ","27-Nov-12  ","27-Nov-17  ","Dhaka  ","Bangladesh  ","  ","local"
"2131",2131,"Society for Integrated Women Progress (SIWP)    ","North Kalindipur (Opposite of Rani Doyamoyee High School), Residence of Mr.Kushal Dewan (1st Floor), Rangamati Hill District. Phone: 0351-62716","1348     ","14-Feb-99     ","14-Feb-14     ","14-Feb-19     ","Rangamati     ","Bangladesh     ","     ","local"
"2132",2132,"Society for International Ministries (SIM) ","4/14 Humayun Road Mohammadpur, Dhaka. Phone: 04478005870","105  ","3-Sep-81  ","15-May-15  ","15-May-20  ","Dhaka  ","Canada  ","  ","local"
"2133",2133,"Society for Lowest Urban Mass","6638 East Vatara, Badda, Gulshan, Dhaka-1212","2398 ","7-Jan-09 ","7-Jan-14 ","7-Jan-19 ","Dhaka ","Bangladesh "," ","local"
"2134",2134,"Society for Participatory Action & Reflection  ","Room-20, Al-Farid Super Market, 107, Green Road, Farmgate, Dhaka. Phone: 9110227","2424   ","2-Apr-09   ","2-Apr-14   ","2-Apr-19   ","Dhaka   ","Bangladesh   ","   ","local"
"2135",2135,"Society for Participatory Economic Social Development","16, Shah Amanat City Corporation, Chittagong Phone: 01818-026397","2714  ","27-Jun-12  ","27-Jun-17  ","27-Jun-27  ","Chittagong  ","Bangladesh  ","  ","local"
"2136",2136,"Society for Participatory Education and Development (SPED)  ","House-75, Block-B, Road-06, Monsurabad R/A, Adabor, Mohammadpur, Dhaka. Phone: 01716-440532, 819- 386","2566    ","28-Apr-10    ","28-Apr-15    ","28-Apr-20    ","Dhaka    ","Bangladesh    ","    ","local"
"2137",2137,"Society for People's Action in Change Equity (SPACE)   ","House-695/A,Road-11, Baitul Aman Housing Society, Adabor, Dhaka-1207 Phone: 9138772 www. Spacebangladesh.org","2085    ","28-Mar-06    ","28-Mar-16    ","28-Mar-21    ","Dhaka    ","Bangladesh    ","    ","local"
"2138",2138,"Society for Peoples Advancement (SPA)   ","Chand Masjid Road, Rasulpur, Ashrafabad, Kamrangir Char, Dhaka. Phone : 8621677 www.spabd.org","1744    ","7-Oct-02    ","7-Oct-17    ","7-Oct-27    ","Dhaka    ","Bangladesh    ","    ","local"
"2139",2139,"Society for Peoples Education Empowerment and Development Trust ","170 Shayan Babu Lane, Gora Chand Das Road, Barisal-8200 Phone: 0431-61687 www.speedtrust.org","1718   ","8-Jun-02   ","8-Jun-17   ","8-Jun-27   ","Barisal   ","Bangladesh   ","   ","local"
"2140",2140,"Society for Peoples Initiative  ","75-76 Rahabar Tower, Janata Housing Cooperative Society, Adabor, Dhaka. Phone: 01715-009796","2746   ","14-Nov-12   ","14-Nov-17   ","14-Nov-27   ","Dhaka   ","Bangladesh   ","   ","local"
"2141",2141,"Society for Project Implementation Research & Evaluation(SPIRE)","82/9, North Jatrabari, Dhaka- 1204 Phone: 7544812","2014  ","10-Mar-05  ","10-Mar-15  ","10-Mar-20  ","Dhaka  ","Bangladesh  ","  ","local"
"2142",2142,"Society for Promotion of Bangladesh Art","Baliaaree (5th Floor), House-30, Road-130, Gulshan, Dhaka.","1783 ","1-Jun-03 "," ","1-Jun-08 ","Dhaka ","Bangladesh "," ","local"
"2143",2143,"Society for Rehabilitation of Autistic Children (SRAC)  ","K-36, Block-E, Kazi Nazrul Islam Road, Mohammadpur, Dhaka Phone: 01721599288","3057   ","14-Dec-16   ","   ","14-Dec-21   ","Dhaka   ","Bangladesh   ","   ","local"
"2144",2144,"Society for Rehabilitation of Burn Victims (SRBV)","1/8, Block-E, Lalmatia, Dhaka. Phone: 9124436","1161 ","11-Jun-97 ","11-Jun-17 ","11-Jun-27 ","Dhaka ","Bangladesh "," ","local"
"2145",2145,"Society for Research, Disability and Development (SRDD)","763/2-A, Flat-2F, Munipur, Mirpur-2, Dhaka. ","2123  ","13-Aug-06  ","  ","13-Aug-11  ","Dhaka  ","Bangladesh  ","  ","local"
"2146",2146,"Society for Rural Women & Child Development ","9/6 Uttar Pirear Bag, Mirpur, Dhaka-1216 Phone: 01711-806151","2502  ","26-Oct-09  ","  ","26-Oct-14  ","Dhaka  ","Bangladesh  ","  ","local"
"2147",2147,"Society for Social Advancement of Rural People ","Ovizan-222, Ss Academy Road, Madhya Aouchpara, Tongi, Gazipur. Phone: 7214964","2507   ","4-Nov-09   ","4-Nov-14   ","4-Nov-19   ","Gazipur   ","Bangladesh   ","   ","local"
"2148",2148,"Society for Social Services (SSS)","House-6/1, Block-A, Lalmatia, Mohammadpur, Dhaka-1207","345 ","28-Jan-90 ","30-Jan-15 ","30-Jan-20 ","Tangail ","Bangladesh "," ","local"
"2149",2149,"Society for Sustainable Development for the Rural & Urban Area ","House-20, Block-C, Eastern Housing, Pallabi, Mirpur, Dhaka. Phone: 01712-650662, 0192- 235939","2432   ","30-Apr-09   ","30-Apr-19   ","30-Apr-29   ","Dhaka   ","Bangladesh   ","   ","local"
"2150",2150,"Society for Sylhet Resources Advancement Community","Nobarun-231, Uposhahor Road, Shibganj, Sylhet. Phone: 01712319280","3040  ","5-Oct-16  ","  ","5-Oct-21  ","Sylhet  ","Bangladesh  ","  ","local"
"2151",2151,"Society for the Eradication of Illiteracy,Poverty, enemployment and Pollution (SEIPAP)","Aziz Super Market, Room-63 (3rd Floor), Shahbag, Dhaka Phone: 01712-001126 ","1371   ","13-Apr-99   ","13-Apr-04   ","13-Apr-09   ","Dhaka   ","Bangladesh   ","   ","local"
"2152",2152,"Society for the Project Implementation Research Evaluation & Training (SOPIRET)","8/3, Segunbagicha, Ramna, Dhaka Phone : 9559295 ","195   ","23-Jan-86   ","23-Jan-16   ","23-Jan-21   ","Dhaka   ","Bangladesh   ","   ","local"
"2153",2153,"Society for the Promotion of Human Rights (SPHR)","Amjupi Bazar, Amjupi, Meherpur Phone: 01733-928545","1765 ","27-Nov-02 ","27-Nov-17 ","27-Nov-27 ","Meherpur ","Bangladesh "," ","local"
