"","num_var","ngo_name","ngo_address","reg_no","reg_date","renewed_on","valid_until","district","county","remarks","type_ngo"
"719",719,"Dhaka Ahsania Mission    ","House # 19, Road # 12 (New), Dhanmondi R/A., Dhaka Phone : 8119521, 9123420 Fax: 8113010, 8118522 www.ahsaniamission.org","246    ","9-Dec-87    ","9-Dec-17    ","9-Dec-27    ","Dhaka    ","Bangladesh    ","    ","local"
"720",720,"Dhaka Ashania Mohila Mission  ","3, Dhanmondi R/A, Road-08, Dhaka-1205  ","300   ","18-May-89   ","18-May-14   ","18-May-24   ","Dhaka   ","Bangladesh   ","Cacelled on 11/6/2014 Revived on 03- 18-Jun","local"
"721",721,"Dhaka Community Hospital Trust ","190/1, Bara Maghbazar, Wireless Railgate, Dhaka, Tel:9351190-18314887","3234  ","17-Feb-20  ","17-Feb-20  ","17-Feb-30  ","Dhaka  ","Bangladesh  ","  ","local"
"722",722,"Dhaka Institute of Cultural Affairs  ","83/B, New Circular Road, Mouchak Tower (4th floor), Room-506, Dhaka-1217 Phone: 9332023, Fax: 8322799","2488   ","6-Oct-09   ","6-Oct-14   ","6-Oct-19   ","Dhaka   ","Bangladesh   ","   ","local"
"723",723,"Dhaka Palli Sheba Sangstha ","Sholla Bazar, Sholla, Nawbganj, Dhaka Phone: 01819-442087","2940  ","16-Jul-15  ","  ","16-Jul-20  ","Dhaka  ","Bangladesh  ","  ","local"
"724",724,"Dhaka Progressive Lions Eye Hospital","137/2, Basail, Narsingdhi Phone: 0628-63869","1691 ","31-Oct-01 ","31-Oct-16 ","31-Oct-26 ","Narsingdhi ","Bangladesh "," ","local"
"725",725,"Dhaka Rural Advancement Programs Society","Matuail West Para, Zia Sarani Road, Jatrabari, Demra, Dhaka.","2257 ","5-Aug-07 "," ","5-Aug-12 ","Dhaka ","Bangladesh "," ","local"
"726",726,"Dharmarajika Orphanage, Buddhist Monastery  ","Atish Dipankar Sarak, PO: Basabo, PS: Sabujbag, Dhaka- 1214 Phone: 7275665","75   ","22-Apr-81   ","15-May-11   ","15-May-16   ","Dhaka   ","Bangladesh   ","   ","local"
"727",727,"Dhoritri Foundation for Information Education  ","House-50, Road-08, Block-D, Niketon, Gulshan, Dhaka. Phone: 8853958, 8853960 www.dhoritrifoundation.org","2267   ","29-Aug-07   ","29-Aug-12   ","29-Aug-17   ","Dhaka   ","Bangladesh   ","   ","local"
"728",728,"Dhruba  ","2 Navy Gate, Khalishpur, Khulna. Phone: 01711-579722","2738  ","23-Oct-12  ","23-Oct-17  ","23-Oct-27  ","Khulna  ","Bangladesh  ","  ","local"
"729",729,"Dhrubo Society ","Paruli, Bogra Phone : 6578","1732 ","18-Aug-02 ","18-Aug-12 ","18-Aug-22 ","Bogra ","Bangladesh "," ","local"
"730",730,"Diabetic Association of Bangladesh    ","122, Kazi Nazrul Islam Avenue, Shahbag, Dhaka. Phone: 8616641-50, Fax:  967772 www.dab-bd.org","1284     ","1-Sep-98     ","1-Sep-18     ","1-Sep-28     ","Dhaka     ","Bangladesh     ","Cancelled on 25/10/2010, Revived on 8/2/2011  ","local"
"731",731,"Diabetic Samity, Lalmonirhat ","Sonali Park Jail Road, Lalmonirhat. Phone: 01715-359827","2628  ","20-Mar-11  ","  ","20-Mar-16  ","Lalmonirhat  ","Bangladesh  ","  ","local"
"732",732,"DIAKONIA / Swedish Free Church Aid  ","House-5/8, First floor, Block-B, Lalmatia, Dhaka Phone : 9121256, Fax: 9121257 www.diakonia.selenglish","1   ","22-Apr-81   ","15-May-15   ","15-May-20   ","Dhaka   ","Sweden   ","   ","local"
"733",733,"Diganta Memorial Cancer Foundation  ","21, Adarsha Chaianeer Houssing Society, Ring Road, Shamoly, Dhaka-1207 Phone: 9143055","2231   ","13-May-07   ","   ","13-May-12   ","Dhaka   ","Bangladesh   ","   ","local"
"734",734,"Diganta Samaj Kalyan Samity ","Shathia, Post+Upazila: Shathia, Dist.: Pabna Phone: 07327-56234","1995  ","11-Jan-05  ","11-Jan-15  ","11-Jan-20  ","Pabna  ","Bangladesh  ","  ","local"
"735",735,"Digirpar Bastuhara Samaj Kallyan Samity   ","Public Library Road, P.O+Upazila: Monirampur, Jessore Phone : 01712-984709, 01819- 697153","1733    ","27-Aug-02    ","27-Aug-12    ","27-Aug-17    ","Jessore    ","Bangladesh    ","    ","local"
"736",736,"Dinajpur Pally Unnayan Prochesta  ","Vill: Rajbati, PO: Rajbati, Upazila: Dinajpur Sadar, Dist: Dinajpur Phone: 01719-418940","2831   ","6-Nov-13   ","6-Nov-18   ","6-Nov-28   ","Dinajpur   ","Bangladesh   ","   ","local"
"737",737,"Dip Unnayan Society   ","P.O: Kishoreganj, Mozammel Road, Lalmohan, Bhola Phone: 01711-007821, Fax: 04925-75956","1720   ","10-Jun-02   ","10-Jun-17   ","10-Jun-27   ","Bhola   ","Bangladesh   ","   ","local"
"738",738,"Dipshika Polli Unnayan Karmoshuchi (DPUK) ","Vill: Birtara, P.O: Birkadamtoli, Upazila: Modhupur, Dist: Tangail Phone: 01727-424215","2482  ","17-Sep-09  ","17-Sep-14  ","17-Sep-19  ","Tangail  ","Bangladesh  ","  ","local"
"739",739,"DipShikha Anirban  ","79, Sher-E-Bangla Sarak, Jheanaidah-7300 Phone: 0451-63723","1232  ","18-Jan-98  ","18-Jan-13  ","18-Jan-18  ","Jhenaidah  ","Bangladesh  ","  ","local"
"740",740,"Dipshikha Non Formal Education, Training and Research Society for Village Development","282/5 1st Colony, Mazar Road, Lalkuti, Mirpur-1, Dhaka Phone : 9000782, Fax: 8031247 www.dipshikha.org","190   ","20-Nov-85   ","20-Nov-15   ","20-Nov-20   ","Dhaka   ","Bangladesh   ","   ","local"
"741",741,"Dipta A Foundation for Gender & Development (DIPTA)","2/C/2, egun Bagicha, Dhaka. Phone: 01711-816622 ","2786  ","19-May-13  ","19-May-18  ","19-May-28  ","Dhaka  ","Bangladesh  ","  ","local"
"742",742,"Dipti Foundation    ","House-15, Block-B, Main Road, Ward-02, Khagon, Biluria Road, Savar, Dhaka-1240  Phone: 01713-042814","1361    ","6-Apr-99    ","6-Apr-14    ","6-Apr-19    ","Dhaka    ","Bangladesh    ","Cancelled on 06/05/2010, Revived on 12/10/2015 ","local"
"743",743,"Direct Action for Allev. of Poverty and Protection of the Environmnt","House-11, Road-07, Block-H, Banani, Dhaka-1213 ","1340  ","14-Jan-99  ","14-Jan-14  ","14-Jan-19  ","Dhaka  ","Bangladesh  ","  ","local"
"744",744,"Disability Inquisition Activities (DIA) ","Bishoykhali Bazar, Khorikhali, Sadar, Jhenaidah Mob: 01768946290","3205  ","1-Jul-19  ","  ","1-Jul-29  ","Jhenaidah  ","Bangladesh  ","  ","local"
"745",745,"Disable Development & Educational Foundation ","Vill+PO: Raihanpur, PS: Pathorgata, Dist: Barguna. Phone: 01712-136558","2608  ","4-Nov-10  ","4-Nov-15  ","4-Nov-20  ","Barguna  ","Bangladesh  ","  ","local"
"746",746,"Disabled Child Foundation   ","551, Peyarabag, Moghbazar, Dhaka-1217 Phone: 02-9335941, 01732- 675775","2436   ","5-Dec-09   ","12-May-14   ","12-May-19   ","Dhaka   ","Bangladesh   ","   ","local"
"747",747,"Disabled Development Organization","Park Para, Jhenaidah Phone: 01728-125599","2880 ","19-Aug-14 "," ","19-Aug-19 ","Jhenaidah ","Bangladesh "," ","local"
"748",748,"Disabled Rehabilitation and Research Association (DRRA)  ","House-2/5, Road-01, Shamoly, Dhaka-1207 Phone: 9140162, Fax: 9124057 Mobile: 01197-015854 www.drrabd.org","1209    ","5-Nov-97    ","5-Nov-17    ","5-Nov-27    ","Dhaka    ","Bangladesh    ","    ","local"
"749",749,"Disabled Welfare Society   ","House-95/Ka (1st Fl.), Road-8, Janata Housing, Section-2, Mirpur-1, Dhaka Phone: 9013405","2794   ","16-Jun-13   ","   ","16-Jun-18   ","Dhaka   ","Bangladesh   ","   ","local"
"750",750,"Disabled Women Development Organization (DWDO) ","Ovhijan-178, Safiuddin Academy Road, Middle Aoushpara, Tangi, Gazipur. Phone: 9810603, 01915-620299","2319   ","17-Mar-08   ","17-Mar-18   ","17-Mar-28   ","Gazipur   ","Bangladesh   ","   ","local"
"751",751,"Disadvantaged Adolescent Working NGOs (DAWN) Forum","House-599, Road-10, (Baitul Aman Housing Society), Adabar, Dhaka.","1354  ","7-Mar-99  ","7-Mar-04  ","7-Mar-09  ","Dhaka  ","Bangladesh  ","  ","local"
"752",752,"Disha Samaj Kalyan Somity ","Kabi Golam Mostafa Sarak, Jessore Phone: 042-65312","463  ","23-Jan-93  ","23-Jan-13  ","23-Jan-18  ","Jessore  ","Bangladesh  ","  ","local"
"753",753,"Disha Secchasebi Artha Samajik Unnayan O Manabik Kallyan Sangstha   ","Desha Tower, Upazila More, Kustia-Jhenaidah Highway, Kushtia Phone: 071-73402, Fax: 071- 7154 www.desha.org.bd","1589     ","29-Nov-00     ","29-Nov-15     ","29-Nov-20     ","Kustia     ","Bangladesh     ","     ","local"
"754",754,"Dishari Foundation  ","17/2-C, Tallabag, Shukrabad, Dhaka. Phone: 01718-235727","2459  ","17-Jun-09  ","17-Jun-14  ","17-Jun-19  ","Dhaka  ","Bangladesh  ","  ","local"
"755",755,"DNET    ","6/8 Humayun Road, Block-B, Mohammadpur, Dhaka-1207 Phone: 8156772, 8126976 Fax: 8142021 www.dnet.org.bd","1918    ","7-Apr-04    ","7-Apr-14    ","7-Apr-19    ","Dhaka    ","Bangladesh    ","    ","local"
"756",756,"Do Better for the Children (DBC) ","33/Kha, Rabeya Commercial Complex (4th Floor), Main Road, Mirpur-10, Dhaka-1216.","2113  ","18-Jul-06  ","18-Jul-11  ","18-Jul-21  ","Dhaka  ","Bangladesh  ","  ","local"
"757",757,"Doctor Baker's Organisation for Well Being ","Kailakuri, Hagurakuri, Madhupur, Tangail, Mob: 1727046886","3211  ","22-Jul-19  ","  ","22-Jul-29  ","Tangail  ","Bangladeshi  ","  ","local"
"758",758,"Dodomari Gram Unnayan Sangstha  ","Vill: Dodomari, P.O:Panchagarh, Dist: Panchagarh Phone: 01721-887987","1429   ","21-Sep-99   ","21-Sep-14   ","21-Sep-19   ","Panchagar   ","Bangladesh   ","   ","local"
"759",759,"Doorbar Network  ","Plot-1,3,5, Road-5/A, Satmosjit Road, Dhanmondi, Dhaka. Phone: 8119917, 01714-038066","2439  ","24-May-09  ","  ","24-May-14  ","Dhaka  ","Bangladesh  ","  ","local"
"760",760,"DOPS Foundation  ","Vill: Monduar, PO & UZ: Sadullapur, Gaibandha Phone: 0521-53107","2604  ","12-Oct-10  ","12-Oct-15  ","12-Oct-20  ","Gaibandha  ","Bangladesh  ","  ","local"
"761",761,"Dr. B.P. Social Welfare Foundation  ","Putibila Mohabodhi Biher, PO: M. Char Hat, PS: Lohagora, Dist: Chittagong. Phone: 01711-567563","2725   ","28-Aug-12   ","   ","28-Aug-17   ","Chittagong   ","Bangladesh   ","   ","local"
"762",762,"Dr. Jamal Uddin Foundation","Vill+PO: Dariapur, PS: Majibnagar,Dist: Meherpur.","2886 ","21-Aug-14 "," ","21-Aug-19 ","Meherpur ","Bangladesh "," ","local"
"763",763,"Dr. K. Zaman BNSB Eye Hospital   ","193, Shewra, Dhopakhola Road, Mymensing-2200 Phone: 091-66982, Fax: -91 63522 www.bnsbmym.org","2141    ","8-Oct-06    ","8-Oct-16    ","8-Oct-26    ","Mymensingh    ","Bangladesh    ","    ","local"
"764",764,"Dristi ","Laksam Road, Comilla-3500 Phone: 081-67583","1555 ","21-Aug-00 ","21-Aug-15 ","21-Aug-20 ","Comilla ","Bangladesh "," ","local"
"765",765,"Dristidan Eye Hospital  ","Ranbijoypur, C & B Road, Bagerhat Phone: 0468-63761","2458  ","11-Jun-09  ","11-Jun-14  ","11-Jun-19  ","Bagerhat  ","Bangladesh  ","  ","local"
"766",766,"Dristri Protibandhi Unnayan Parishad ","City Corporation Market, Murgipatry, Rayerbazar, Dhaka Phone: 01724-523623","2850  ","11-Mar-14  ","  ","11-Mar-19  ","Dhaka  ","Bangladesh  ","  ","local"
"767",767,"Durjoy Nari Shangha    ","122, PiciCulture Housing Society, Road-1, Block-Ka, Mohammadpur, Dhaka Phone: 8143028., 01712-576373","2040    ","10-Oct-05    ","10-Oct-10    ","10-Oct-15    ","Dhaka    ","Bangladesh    ","    ","local"
"768",768,"Dushtha Shasthya Kendra (DSK)   ","House-741, Road-09, Baitul Aman Housing Society, Mohammadpur, Dhaka. Phone : 9128520, 8122861 Fax: 8115764","577    ","26-Dec-91    ","26-Dec-16    ","26-Dec-21    ","Dhaka    ","Bangladesh    ","    ","local"
"769",769,"Dustha Kalyan-O- Punarbasan Sangstha ","Vill: Adabari, P.O. Habla, Tangail Phone: 01726-895379","559  ","12-Nov-91  ","12-Nov-11  ","12-Nov-16  ","Tangail  ","Bangladesh  ","  ","local"
"770",770,"Dustha Mahila Punarbasan Kendra (Center for Rehabilitation of Destitute Women)","Vill. Gopinathpur, Post. Laksmipasha, Thana- Lohagora, Norail. ","1074   ","8-Sep-96   ","   ","8-Sep-01   ","Narail   ","Bangladesh   ","   ","local"
"771",771,"Dustha Manabatar Seba Sangstha(DMSS) ","Joypurhat Sadar Road, Khanjonpur, Joypurhat Phone: 0571-62121","1030  ","20-Apr-96  ","20-Apr-16  ","20-Apr-26  ","Joypurhat  ","Bangladesh  ","  ","local"
"772",772,"Dustha Manob Kallayan Sangstha ","Raytan Barsho, Kaliganjhat, Tanor, Rajshahi Phone: 01960-812547","2985  ","10-Nov-15  ","  ","10-Nov-20  ","Rajshahi  ","Bangladesh  ","  ","local"
"773",773,"Dustha Mayader Nirapad Ashram & Punarbashon Kendra","Bawraid Master Bari, EPSA, Gazipur. Phone: 01713-014924","2650  ","26-Jun-11  ","26-Jun-16  ","26-Jun-21  ","Gazipur  ","Bangladesh  ","  ","local"
"774",774,"Dustha Nari-O-Shishu Kallyan Sangstha ","502, Manikdi Bazar, Dhaka Cantonment, Dhaka Phone : 9880675","1310  ","15-Nov-98  ","15-Nov-03  ","15-Nov-08  ","Dhaka  ","Bangladesh  ","  ","local"
"775",775,"Dustha O Bhumiheen Samaj Kallyan Sangstha ","Vill: Chatiangacha, PO: Hero Banpara Bazar, UZ: Baraigram, Dist: Natore","1599  ","13-Dec-00  ","12-Dec-10  ","12-Dec-15  ","Natore  ","Bangladesh  ","  ","local"
"776",776,"Dustho Kalyan Sangstha   ","Limon Manjil, Puran Bazar, Nalcithi Bandor, Jhalakathi Phone: 01823014428 ","432   ","22-Jan-91   ","22-Jan-16   ","22-Jan-21   ","Jhalokathi   ","Bangladesh   ","Cancelled on 09/05/2010, Revived on 26/06/2013","local"
"777",777,"Dustho Manobik Seba Songstha (DMSS) ","Sorishabari Bazar, Zewpara, Puhtia, Rajshahi, Mob: 1716352349","3204  ","3-Jun-19  ","  ","3-Jun-29  ","Rajshahi  ","Bangladesh  ","  ","local"
"778",778,"Dwip Shetu  ","Prof. MA Matin Road, PO: Sialkole, Dist: Sirajganj. Phone: 0751-62508","411  ","26-Nov-90  ","26-Nov-15  ","26-Nov-20  ","Sirajganj  ","Bangladesh  ","  ","local"
"779",779,"Dwip Unnayan Shangstha  ","Syadia Bazar, Hatiya, Noakhali. Phone: 01712-580080, 9122145 www.dusbangladesh.org","181  ","28-Apr-85  ","15-May-15  ","15-May-20  ","Noakhali  ","Bangladesh  ","  ","local"
"780",780,"EADA (Environment and Agricultural Development Association  ","KBA Road, Nalta, Kaliganj, Satkhira-9441 Phone: 01712-202934, 04733- 51197 www.eada.org.bd","2240    ","28-May-07    ","28-May-17    ","28-May-27    ","Sathkhira    ","Bangladesh    ","    ","local"
"781",781,"Eakok Attomanobik Unnayan Sangstha   ","13/A 7/A, Babor Road (Rimjhim), Block-B, Mohammadpur, Dhaka-1207 Phone: 9677009 www.eakok.org","1576    ","15-Oct-00    ","15-Oct-15    ","15-Oct-20    ","Dhaka    ","Bangladesh    ","    ","local"
"782",782,"Earth Identity Project    ","House-67/A, (2nd Floor), Road- 04, Plot-C, Banani, Dhaka-1213 Phone: 880-2-8825643, 8812050 Fax: 880-2-8822275","1969    ","9-Oct-04    ","9-Oct-14    ","9-Oct-19    ","Dhaka    ","Bangladesh    ","    ","local"
"783",783,"Eastern Development Association (EDA) ","Bijoy Sharani Tower, 121/3, Tejkunipara, Tejgaon, Dhaka. Phone: 8127925","1385  ","18-May-99  ","19-May-09  ","19-May-19  ","Dhaka  ","Bangladesh  ","  ","local"
"784",784,"Echo Society  ","343 Elephant Road ((3rd Fl.), New Market, Dhaka Phone: 01712-419699","2836  ","21-Nov-13  ","21-Nov-18  ","21-Nov-28  ","Dhaka  ","Bangladesh  ","  ","local"
"785",785,"ECO-Development    ","Vill: Uzanipara, Main Road, PO+PS: Bandarban Sadar, Dist: Bandarban. Phone: 0361-63260 www.ecodevelopment.org","2607    ","1-Nov-10    ","1-Nov-15    ","1-Nov-20    ","Bandarban    ","Bangladesh    ","    ","local"
"786",786,"Economic Development and Energy of Nation (EDEN)","Rasulpur Bazar, P.O:Abdullahpur, Thana: Keraniganj, Dhaka","1806  ","19-Mar-03  ","  ","19-Mar-08  ","Dhaka  ","Bangladesh  ","  ","local"
"787",787,"Eco-Social Development Organisation   ","Vill. College Para, Post & Dist. Thakurgaon Phone: 0561-52149, 0174- 63360 www.esdo-bangladesh.org","694    ","15-Mar-93    ","15-Mar-18    ","15-Mar-28    ","Thakurgaon    ","Bangladesh    ","    ","local"
"788",788,"Ecota Samaj Kallyan Sangstha ","Vill+P.O: Bhelabari, P.S: Adidmari, Lalmonirhat Phone: 01849-745664","1306  ","3-Nov-98  ","3-Nov-18  ","3-Nov-28  ","Lalmonirhat  ","Bangladesh  ","  ","local"
"789",789,"ECS-Education & Cultural Society","2/10/R, Tolarbag, Mirpur, Dhaka Mob: 01912179082","3226 ","14-Nov-19 "," ","14-Nov-29 ","Dhaka ","Bangladesh "," ","local"
"790",790,"Education and Development Foundation- Educo  ","Road-34, House-504 (2nd, 3rd, 4th Floors), Mohakhali DOHS, Dhaka-1206, Phone:8813246, 8816367 www.intervida.org","1452    ","5-Dec-99    ","5-Dec-14    ","5-Dec-19    ","Dhaka    ","Spain    ","    ","local"
"791",791,"Education Development and Services (EDAS)   ","Pulerhat, Jessore-Benapole Road, Jessore Sadar, Jessore- 7400 Phone: 0152347178, www.edas.org","3090    ","19-Sep-17    ","    ","19-Sep-27    ","Jessore    ","Bangladesh    ","    ","local"
"792",792,"Educational Charitable & Humanitorian Organization ","Flat-D, Kha-214/E, Progati Tower, Progati Sarani, Merul Badda, Dhaka.","2749  ","9-Dec-12  ","9-Dec-17  ","9-Dec-27  ","Dhaka  ","Bangladesh  ","  ","local"
"793",793,"Efforts for Rural Advancement (ERA)  ","49, Mollika Mollikpur R/A, Sunamganj. Phone: 0871-55157 www.era-haor.org","2276   ","11-Oct-07   ","11-Oct-17   ","11-Oct-27   ","Sunamganj   ","Bangladesh   ","   ","local"
"794",794,"Ekmatra Society  ","House-1286/1, East Manipur, Mirpur-10, Dhaka. Phone: 01711-445779","2825  ","28-Oct-13  ","  ","28-Oct-18  ","Dhaka  ","Bangladesh  ","  ","local"
"795",795,"Elavating Society through Skill Development ","House-36, Road-9/a, Dhanmondi, Dhaka Phone: 9116108","3004  ","8-Feb-16  ","  ","8-Feb-21  ","Dhaka  ","Bangladesh  ","  ","local"
"796",796,"Eminance Association for Social Development","713, Block-E, Lalmatia, Dhaka. Phone: 9146063","2632 ","24-Mar-11 ","24-Mar-16 ","24-Mar-26 ","Dhaka ","Bangladesh "," ","local"
"797",797,"Empowerment through Law of the Common People ","Sagorica Complex-B, Suite- 1/South, 46 Mirpur Road (Bashundara Goli), Dhaka Phone: 8653542, 01715-120033","2037   ","29-Jun-05   ","   ","29-Jun-10   ","Dhaka   ","Bangladesh   ","   ","local"
"798",798,"Enfants Du Monde (International Union for Child Welfare) ","House 9/A(3rd Floor), Rd- 15(New), Dhanmondi R/A., Dhaka Phone : 9114133, Fax: 8112838","76   ","22-Apr-81   ","15-May-15   ","15-May-20   ","Dhaka   ","Switzerland   ","   ","local"
"799",799,"Engender Health Int.   ","Concord Royal Court, House- 40, Road-27 (16 New), Dhanmondi, Dhaka-1209, Phone:02-58156202","3179   ","11-Dec-18   ","   ","11-Dec-28   ","Dhaka   ","USA   ","   ","local"
"800",800,"Ensure Devt. Activities for Vulnerable Underprivileged Rural People (ENDEAVOUR)","5/15, Humayun Road, Mohammadpur, Dhaka-1207 Phone: 9124342 ","1168   ","3-Jul-97   ","3-Jul-17   ","3-Jul-27   ","Dhaka   ","Bangladesh   ","   ","local"
"801",801,"Ensure Legal Support through Local Movement & Action (ELLMA)  ","Nurjahan Place, Plot-71, Road- 02, (Gha), Sugandha R/A, Panchlaish, Chittagong Phone: 031-650780 www.ellma.org","2589    ","22-Jul-10    ","22-Jul-15    ","22-Jul-20    ","Chittagong    ","Bangladesh    ","    ","local"
"802",802,"Environment and Population Research Centre (EPRC) ","House-241, Road-15, New DOHS, Mohakhali, Dhaka. Phone: 8822772, Fax: 8822772 www.eprchbd.org","1674   ","25-Sep-01   ","25-Sep-16   ","25-Sep-21   ","Dhaka   ","Bangladesh   ","   ","local"
"803",803,"Environment Concern Foundation ","House-43, Road-13, Block-D, Banani, Dhaka Phone: 01718330985","3041  ","5-Oct-16  ","  ","5-Oct-21  ","Dhaka  ","Bangladesh  ","  ","local"
"804",804,"Environmental Pollution Eradication and Agricultural Devt. Organ.","336, T.V. Road, East Rampura, Dhaka. Phone: 9343149, Fax: 9330270","1194  ","6-Oct-97  ","6-Oct-07  ","6-Oct-12  ","Dhaka  ","Bangladesh  ","  ","local"
"805",805,"Environmental Research & Development Alternatives ","6/17, Block-B, Babor Road, Mohammedpur, Dhaka Phone: 01711862783","3010  ","29-Feb-16  ","  ","28-Feb-21  ","Dhaka  ","Bangladesh  ","  ","local"
"806",806,"Environmunt & Social Development Organization  ","House-8/1, Lvel-04, Block-C, Lalmatia, Dhaka. Phone :9122729, Fax: 9130017 www.esdo.org","962   ","12-Aug-95   ","12-Aug-15   ","12-Aug-20   ","Dhaka   ","Bangladesh   ","   ","local"
"807",807,"Esho Banchte Shikhee  ","Keshobpur Bazar, Keshob, Jessore Phone: 01913-693420","2034  ","2-Feb-06  ","2-Feb-16  ","2-Feb-21  ","Jessore  ","Bangladesh  ","  ","local"
"808",808,"Esho Desh Gori   ","P.O: Jummahat, Thana: Ulipur, Kurigram Phone: 01716-342931, 0171- 678194","699   ","20-Apr-93   ","20-Apr-13   ","20-Apr-18   ","Kurigram   ","Bangladesh   ","   ","local"
"809",809,"Esho Jibon Gori   ","House-711, Kewachala, P.S.: Sreepur, Dist.: Gazipur. Phone: 77950305, 01727- 210916","2329   ","31-Mar-08   ","   ","31-Mar-13   ","Gazipur   ","Bangladesh   ","   ","local"
"810",810,"ETHEWS  ","Ward-1, Dabaria, Shahzadpur, Sirajganj Phone: 01761266849","3069  ","2-Jan-17  ","  ","2-Jan-22  ","Sirajganj  ","Bangladesh  ","  ","local"
"811",811,"Ethnic Community Development Organization (ECDO) ","17 Urmi (1st Fl.), West Shibganj, Sylhet. Phone: 0821-760240 www.ecdo-bd.org","2385   ","21-Aug-08   ","21-Aug-18   ","21-Aug-28   ","Sylhet   ","Bangladesh   ","   ","local"
"812",812,"ETU Foundation ","Vill: Pathergata, Post: Jadanga, PS&Dist: Sathkhira.","2692 ","2-May-12 ","2-May-17 ","2-May-27 ","Sathkhira ","Bangladesh "," ","local"
"813",813,"Euro Bangla Foundation (EBF)   ","Post+Upazila: Vedergonj, Dist.: Shariatpur. Phone: 01714-665959, 01715- 278118 www.eurobanglafoundation.li","2312    ","2-Mar-08    ","2-Mar-18    ","2-Mar-28    ","Shariatpur    ","Bangladesh    ","    ","local"
"814",814,"Eventful Bangladesh Society","House-464 (2nd Floor), Road- 01, Mohakhali, Dhaka","2882 ","19-Aug-14 "," ","19-Aug-19 ","Dhaka ","Bangladesh "," ","local"
"815",815,"F H Association  ","House # 81, Road-04, Block # B, Banani, Dhaka. Phone : 9880826, 9894382","102  ","28-Aug-81  ","16-Jul-15  ","16-Jul-20  ","Dhaka  ","Netherlands  ","  ","local"
"816",816,"Fair Foundation  ","103, Central Block, Eidgah Road, Khalispur, Khulna. Phone: 041-763518","1815  ","20-Apr-03  ","20-Apr-08  ","20-Apr-13  ","Khulna  ","Bangladesh  ","  ","local"
"817",817,"Fair World of Bangladesh ","37, Ananda Mohan Avenue (Boro Bazar) Sadar, Mymensing.","3106 ","7-Nov-17 "," ","7-Nov-27 ","Mymensingh ","Bangladesh "," ","local"
"818",818,"Faith & Hope Welfare Association ","414/3, East Goran, Khilgaon, Dhaka-1219. Phone: 7291634,01716-633005","2549  ","7-Mar-10  ","7-Mar-15  ","7-Mar-20  ","Dhaka  ","Bangladesh  ","  ","local"
"819",819,"Faith in Action  ","Maya Kutir, 31 College Para, Magura Phone: 9140304","2780  ","9-Apr-13  ","9-Apr-18  ","9-Apr-28  ","Magura  ","Bangladesh  ","  ","local"
"820",820,"Families for Children   ","House-01, Road-10, Sector-09, Uttara, Dhaka-1230 Phone: 5895219, Fax: 8918197- 8","48   ","22-Apr-81   ","15-May-15   ","15-May-20   ","Dhaka   ","Canada   ","   ","local"
"821",821,"Family and Community Empowerment Support (FACES)","1/D, North Adabar, ring Road, Shyamoli, Dhaka-1207 Phone: 8156918, Fax: 8156918","2196  ","19-Feb-07  ","19-Feb-17  ","19-Feb-27  ","Dhaka  ","Bangladesh  ","  ","local"
"822",822,"Family Development Service & Research(FDSR)  ","216, Ashkona Ashkona, Medicall Road, Uttara, Dhaka- 1230 Phone: 8912469","285   ","22-Feb-89   ","22-Feb-14   ","22-Feb-19   ","Dhaka   ","Bangladesh   ","   ","local"
"823",823,"Family Health International   ","House-05, Road-35, Gulshan-2, Dhaka-1212 Phone: 9887561, Fax: 9887563 www.fhi.org","2258   ","8-Aug-07   ","8-Aug-17   ","8-Aug-27   ","Dhaka   ","USA   ","   ","local"
"824",824,"Family Planning Association of Bangladesh ","2, Naya Paltan, Dhaka Phone :8311423, Fax: 8317385 www.fpab.org","68  ","22-Apr-81  ","15-May-15  ","15-May-20  ","Dhaka  ","Bangladesh  ","  ","local"
"825",825,"Family Welfare Association  ","PO: Gogari, PO: Manda, Dist: Naogaon Phone: 01717-198940","1490  ","2-Mar-00  ","2-Mar-10  ","2-Mar-15  ","Dhaka  ","Bangladesh  ","  ","local"
"826",826,"Far Reaching Economical & Environmental Development","Art Galary, Thakurgaon Phone: 01716-920439 ","2720  ","30-Jul-12  ","30/07/2017  ","30-Jul-27  ","Thakurgaon  ","Bangladesh  ","  ","local"
"827",827,"Fareea Lara Foundation  ","House-16/A, Road-2, Shaymoli, Dhaka Mob: 01715259999","3194  ","6-Mar-19  ","  ","6-Mar-24  ","Dhaka  ","Bangladesh  ","  ","local"
"828",828,"Fatema Rural Education & Health Centre","Vill. Muradpur, P.O. Temuhani, Chittagong","187 ","20-Nov-85 ","20-Nov-05 ","20-Nov-10 ","Chittagong ","Bangladesh "," ","local"
"829",829,"Fatema Sangstha  ","Vill: Ulla, PO: Baharatkhali, Uza: Shagata, Dist: Gaibandha. Phone: 01715-043451","492  ","20-Jun-91  ","20-Jun-11  ","20-Jun-16  ","Gaibandha  ","Bangladesh  ","  ","local"
"830",830,"Fellowship for Disadvantaged Peoples (FDP)","Vill.: South Bobanipur, Road-6, House-32, Rajbari-7700 ","2026  ","7-Apr-05  ","7-Apr-10  ","7-Apr-15  ","Rajbari  ","Bangladesh  ","  ","local"
"831",831,"FEMA  ","House-1/11, Iqbal Road, Block- A, Mohammadpur, Dhaka-1207 Phone: 9140302, Fax: 8112767","2035  ","7-May-05  ","7-May-10  ","7-May-15  ","Dhaka  ","Bangladesh  ","  ","local"
"832",832,"Fida International Bangladesh ","346 East Padardia, Satarkul Road, North Badda, Dhaka-1212 Phone: +88-02-9895698","38  ","22-Apr-81  ","15-May-15  ","15-May-20  ","Dhaka  ","Finland  ","  ","local"
"833",833,"Fight Against Poverty (FAP)   ","College Road, Meherpur (Building of Shahid Hazi), Post Code:7100, Post+Dist.: Meherpur. Phone: 0791-62602, 62264","1992    ","3-Jan-05    ","    ","3-Jan-10    ","Meherpur    ","Bangladesh    ","    ","local"
"834",834,"Fight for the Hunger   ","P.O.: Shiberhat, PS: Sandwip, Chittagong. Phone: 01711-379307, 01716- 147779","1077   ","26-Sep-96   ","26-Sep-16   ","26-Sep-21   ","Dhaka   ","Bangladesh   ","   ","local"
"835",835,"Financial and Environmental Development Association- FEDA","Vill- Boynna, Post- ToperBari, Upazila- Dhamrai, Dis.- Dhaka. Phone: 9672075, 01720-04041 ","1964   ","25-Sep-04   ","   ","25-Sep-09   ","Dhaka   ","Bangladesh   ","   ","local"
"836",836,"Financial Development Organisation (FDO) ","House-46, Road-03, Adabar, Dhaka. Phone: 8190626","1381  ","16-May-99  ","16-May-09  ","16-May-14  ","Dhaka  ","Bangladesh  ","  ","local"
"837",837,"Fokhihul Millat Foundation ","Block-D, Road- Fokhihul Millat Road, Thana- Badda, Dhaka","2347 ","11-May-08 "," ","11-May-13 ","Dhaka ","Bangladesh "," ","local"
